{
  "schema_version": "1.0",
  "skill_id": "bid-evidence-matching",
  "project_id": "SIM-WB-20261011",
  "artifact_id": "ART-09-EVIDENCE-SELECTION",
  "revision": 1,
  "created_at": "2026-10-10T23:15:21.925232+00:00",
  "status": "needs_review",
  "inputs": [
    {
      "artifact_id": "ART-01-NATIVE",
      "revision": 1,
      "relative_path": "artifacts/01-source-intake.json",
      "sha256": "e54a67dd19063b1f9e1345fa55cad3525f62891b1fc03b5645dc644b7852f464"
    },
    {
      "artifact_id": "ART-02-TENDER-ROUTING",
      "revision": 1,
      "relative_path": "artifacts/02-tender-routing.json",
      "sha256": "43009f353aa6b48ab2b7b9f5c59a5fe95257e82d2c09310f65dcba066adada67"
    }
  ],
  "summary": "材料选用为零：本次测试未提供任何供应商材料，三项关键材料组登记为 missing，不将描述文字或生成图片当作证明材料。",
  "data": {
    "materials": [],
    "selections": [
      {
        "id": "SEL-CERT",
        "target_ids": [
          "C-Q1",
          "REQ-CERT-1"
        ],
        "material_ids": [],
        "state": "missing",
        "reason": "本次测试未提供营业执照复印件，无法选用任何材料组。",
        "required_count": 1,
        "independent_count": 0,
        "confirmation_ref": null
      },
      {
        "id": "SEL-SIGN",
        "target_ids": [
          "C-Q2",
          "REQ-SIGN-1"
        ],
        "material_ids": [],
        "state": "missing",
        "reason": "本次测试未提供有效签署与盖章的投标函。",
        "required_count": 1,
        "independent_count": 0,
        "confirmation_ref": null
      },
      {
        "id": "SEL-PERF",
        "target_ids": [
          "REQ-PERF-1"
        ],
        "material_ids": [],
        "state": "missing",
        "reason": "本次测试未提供软件平台集成合同复印件及验收证明。",
        "required_count": 2,
        "independent_count": 0,
        "confirmation_ref": null
      }
    ],
    "gaps": [
      "缺少营业执照复印件（C-Q1 / REQ-CERT-1）。",
      "缺少投标函签署及盖章（C-Q2 / REQ-SIGN-1）。",
      "缺少软件平台集成合同复印件与验收证明（REQ-PERF-1 / S5）。",
      "缺少人员资料与培训计划（S4-2）。",
      "缺少本供应商报价（S1）。"
    ]
  },
  "warnings": [
    "选材为空是测试输入状态，不代表企业缺乏这些材料。"
  ],
  "blockers": [
    "资格与业绩证明材料缺失，相关目标无法满足或核验，保留阻塞。"
  ]
}
